[
  {
    "id": "terrain.meadow.a",
    "numericId": 0,
    "packId": "base",
    "weight": 14,
    "mesh": "/assets/proxies/base/meadow-a.proxy.json",
    "rotationQuarterTurns": [0],
    "sockets": {
      "N": "OPEN_FLAT",
      "E": "OPEN_FLAT",
      "S": "OPEN_FLAT",
      "W": "OPEN_FLAT"
    },
    "tags": ["meadow", "open", "walkable", "safe"],
    "walkable": true,
    "lethal": false,
    "heightClass": 0,
    "fallbackRank": 0,
    "neighborBias": { "meadow": 1.35, "wild_grass": 1.12 }
  },
  {
    "id": "terrain.meadow.b",
    "numericId": 1,
    "packId": "base",
    "weight": 9,
    "mesh": "/assets/proxies/base/meadow-b.proxy.json",
    "rotationQuarterTurns": [0],
    "sockets": {
      "N": "OPEN_FLAT",
      "E": "OPEN_FLAT",
      "S": "OPEN_FLAT",
      "W": "OPEN_FLAT"
    },
    "tags": ["meadow", "open", "walkable", "safe"],
    "walkable": true,
    "lethal": false,
    "heightClass": 0,
    "fallbackRank": 0,
    "neighborBias": { "meadow": 1.25, "flowers": 1.15 }
  },
  {
    "id": "terrain.wild-grass",
    "numericId": 2,
    "packId": "base",
    "weight": 10,
    "mesh": "/assets/proxies/base/wild-grass.proxy.json",
    "rotationQuarterTurns": [0],
    "sockets": {
      "N": "OPEN_FLAT",
      "E": "OPEN_FLAT",
      "S": "OPEN_FLAT",
      "W": "OPEN_FLAT"
    },
    "tags": ["wild_grass", "open", "walkable", "safe"],
    "walkable": true,
    "lethal": false,
    "heightClass": 0,
    "fallbackRank": 0
  },
  {
    "id": "terrain.dry-soil",
    "numericId": 3,
    "packId": "base",
    "weight": 7,
    "mesh": "/assets/proxies/base/dry-soil.proxy.json",
    "rotationQuarterTurns": [0],
    "sockets": {
      "N": "OPEN_FLAT",
      "E": "OPEN_FLAT",
      "S": "OPEN_FLAT",
      "W": "OPEN_FLAT"
    },
    "tags": ["dry", "open", "walkable", "safe"],
    "walkable": true,
    "lethal": false,
    "heightClass": 0,
    "fallbackRank": 0
  },
  {
    "id": "terrain.stone-flat",
    "numericId": 4,
    "packId": "base",
    "weight": 5,
    "mesh": "/assets/proxies/base/stone-flat.proxy.json",
    "rotationQuarterTurns": [0],
    "sockets": {
      "N": "OPEN_FLAT",
      "E": "OPEN_FLAT",
      "S": "OPEN_FLAT",
      "W": "OPEN_FLAT"
    },
    "tags": ["stone", "open", "walkable", "safe"],
    "walkable": true,
    "lethal": false,
    "heightClass": 0,
    "fallbackRank": 0
  },
  {
    "id": "terrain.path.straight",
    "numericId": 5,
    "packId": "base",
    "weight": 4,
    "mesh": "/assets/proxies/base/path.proxy.json",
    "rotationQuarterTurns": [0, 1],
    "sockets": { "N": "PATH", "E": "OPEN_FLAT", "S": "PATH", "W": "OPEN_FLAT" },
    "tags": ["path", "open", "walkable", "safe"],
    "walkable": true,
    "lethal": false,
    "heightClass": 0,
    "fallbackRank": 0,
    "neighborBias": { "path": 1.8, "meadow": 1.1 }
  },
  {
    "id": "terrain.path.turn",
    "numericId": 6,
    "packId": "base",
    "weight": 4,
    "mesh": "/assets/proxies/base/path.proxy.json",
    "rotationQuarterTurns": [0, 1, 2, 3],
    "sockets": { "N": "PATH", "E": "PATH", "S": "OPEN_FLAT", "W": "OPEN_FLAT" },
    "tags": ["path", "open", "walkable", "safe"],
    "walkable": true,
    "lethal": false,
    "heightClass": 0,
    "fallbackRank": 0,
    "neighborBias": { "path": 1.8, "meadow": 1.1 }
  },
  {
    "id": "terrain.quantum-meadow",
    "numericId": 7,
    "packId": "base",
    "weight": 0.5,
    "mesh": "/assets/proxies/base/quantum-meadow.proxy.json",
    "rotationQuarterTurns": [0],
    "sockets": {
      "N": "OPEN_FLAT",
      "E": "OPEN_FLAT",
      "S": "OPEN_FLAT",
      "W": "OPEN_FLAT"
    },
    "tags": ["meadow", "open", "walkable", "safe", "fallback", "quantum"],
    "walkable": true,
    "lethal": false,
    "heightClass": 0,
    "fallbackRank": 1
  },
  {
    "id": "terrain.quantum-slab",
    "numericId": 8,
    "packId": "base",
    "weight": 0.25,
    "mesh": "/assets/proxies/base/quantum-slab.proxy.json",
    "rotationQuarterTurns": [0],
    "sockets": {
      "N": "OPEN_FLAT",
      "E": "OPEN_FLAT",
      "S": "OPEN_FLAT",
      "W": "OPEN_FLAT"
    },
    "tags": ["stone", "open", "walkable", "safe", "fallback", "quantum"],
    "walkable": true,
    "lethal": false,
    "heightClass": 0,
    "fallbackRank": 2
  },
  {
    "id": "terrain.water.deep",
    "numericId": 9,
    "packId": "water",
    "weight": 4,
    "mesh": "/assets/proxies/water/deep-water.proxy.json",
    "rotationQuarterTurns": [0],
    "sockets": {
      "N": "WET_FLAT",
      "E": "WET_FLAT",
      "S": "WET_FLAT",
      "W": "WET_FLAT"
    },
    "tags": ["water", "deep_water", "wet"],
    "walkable": false,
    "lethal": false,
    "heightClass": 0,
    "fallbackRank": 0,
    "neighborBias": { "deep_water": 2.2, "shallow_water": 1.7 }
  },
  {
    "id": "terrain.water.shallow",
    "numericId": 10,
    "packId": "water",
    "weight": 7,
    "mesh": "/assets/proxies/water/shallow-water.proxy.json",
    "rotationQuarterTurns": [0, 1, 2, 3],
    "sockets": {
      "N": "WET_FLAT",
      "E": "WET_FLAT",
      "S": "BANK_IN",
      "W": "BANK_IN"
    },
    "tags": ["water", "shallow_water", "wet", "walkable"],
    "walkable": true,
    "lethal": false,
    "heightClass": 0,
    "fallbackRank": 0,
    "neighborBias": { "deep_water": 1.45, "shallow_water": 2, "shore": 1.4 }
  },
  {
    "id": "terrain.water.shore",
    "numericId": 11,
    "packId": "water",
    "weight": 6,
    "mesh": "/assets/proxies/water/shore.proxy.json",
    "rotationQuarterTurns": [0, 1, 2, 3],
    "sockets": {
      "N": "BANK_OUT",
      "E": "BANK_OUT",
      "S": "OPEN_FLAT",
      "W": "OPEN_FLAT"
    },
    "tags": ["water", "shore", "wet", "open", "walkable"],
    "walkable": true,
    "lethal": false,
    "heightClass": 0,
    "fallbackRank": 0,
    "neighborBias": {
      "shallow_water": 1.65,
      "shore": 1.8,
      "marsh": 1.3,
      "meadow": 1.15
    }
  },
  {
    "id": "terrain.water.marsh",
    "numericId": 12,
    "packId": "water",
    "weight": 6,
    "mesh": "/assets/proxies/water/marsh.proxy.json",
    "rotationQuarterTurns": [0],
    "sockets": {
      "N": "OPEN_FLAT",
      "E": "OPEN_FLAT",
      "S": "OPEN_FLAT",
      "W": "OPEN_FLAT"
    },
    "tags": ["water", "marsh", "wet", "open", "walkable"],
    "walkable": true,
    "lethal": false,
    "heightClass": 0,
    "fallbackRank": 0,
    "neighborBias": {
      "shore": 1.45,
      "marsh": 1.8,
      "meadow": 1.2,
      "wild_grass": 1.2
    }
  },
  {
    "id": "terrain.forest.moss",
    "numericId": 13,
    "packId": "forest",
    "weight": 9,
    "mesh": "/assets/proxies/forest/moss.proxy.json",
    "rotationQuarterTurns": [0],
    "sockets": {
      "N": "OPEN_FLAT",
      "E": "OPEN_FLAT",
      "S": "OPEN_FLAT",
      "W": "OPEN_FLAT"
    },
    "tags": ["forest", "moss", "open", "walkable"],
    "walkable": true,
    "lethal": false,
    "heightClass": 0,
    "fallbackRank": 0,
    "neighborBias": { "forest": 1.5, "moss": 1.7, "root_ground": 1.25 }
  },
  {
    "id": "terrain.forest.root-ground",
    "numericId": 14,
    "packId": "forest",
    "weight": 7,
    "mesh": "/assets/proxies/forest/root-ground.proxy.json",
    "rotationQuarterTurns": [0, 1],
    "sockets": { "N": "PATH", "E": "OPEN_FLAT", "S": "PATH", "W": "OPEN_FLAT" },
    "tags": ["forest", "root_ground", "path", "walkable"],
    "walkable": true,
    "lethal": false,
    "heightClass": 0,
    "fallbackRank": 0,
    "neighborBias": { "forest": 1.45, "root_ground": 1.8, "path": 1.2 }
  },
  {
    "id": "terrain.forest.clearing",
    "numericId": 15,
    "packId": "forest",
    "weight": 5,
    "mesh": "/assets/proxies/forest/clearing.proxy.json",
    "rotationQuarterTurns": [0],
    "sockets": {
      "N": "OPEN_FLAT",
      "E": "OPEN_FLAT",
      "S": "OPEN_FLAT",
      "W": "OPEN_FLAT"
    },
    "tags": ["forest", "clearing", "meadow", "open", "walkable", "corridor"],
    "walkable": true,
    "lethal": false,
    "heightClass": 0,
    "fallbackRank": 0,
    "neighborBias": { "forest": 1.2, "meadow": 1.2, "clearing": 1.6 }
  },
  {
    "id": "terrain.forest.root-meadow",
    "numericId": 16,
    "packId": "forest",
    "weight": 5,
    "mesh": "/assets/proxies/forest/root-meadow.proxy.json",
    "rotationQuarterTurns": [0],
    "sockets": {
      "N": "OPEN_FLAT",
      "E": "OPEN_FLAT",
      "S": "OPEN_FLAT",
      "W": "OPEN_FLAT"
    },
    "tags": ["forest", "root_ground", "meadow", "open", "walkable", "adapter"],
    "walkable": true,
    "lethal": false,
    "heightClass": 0,
    "fallbackRank": 0,
    "neighborBias": { "forest": 1.25, "root_ground": 1.35, "meadow": 1.2 }
  },
  {
    "id": "terrain.ruin.floor",
    "numericId": 17,
    "packId": "ruin",
    "weight": 6,
    "mesh": "/assets/proxies/ruin/ruin-floor.proxy.json",
    "rotationQuarterTurns": [0],
    "sockets": {
      "N": "RUIN_FLOOR",
      "E": "RUIN_FLOOR",
      "S": "RUIN_FLOOR",
      "W": "RUIN_FLOOR"
    },
    "tags": ["ruin", "ruin_floor", "structural_support", "walkable"],
    "walkable": true,
    "lethal": false,
    "heightClass": 0,
    "fallbackRank": 0,
    "neighborBias": { "ruin": 1.7, "ruin_floor": 1.8 }
  },
  {
    "id": "terrain.ruin.broken-path",
    "numericId": 18,
    "packId": "ruin",
    "weight": 5,
    "mesh": "/assets/proxies/ruin/broken-path.proxy.json",
    "rotationQuarterTurns": [0, 1, 2, 3],
    "sockets": {
      "N": "RUIN_FLOOR",
      "E": "PATH",
      "S": "PATH",
      "W": "RUIN_FLOOR"
    },
    "tags": ["ruin", "broken_path", "path", "structural_support", "walkable"],
    "walkable": true,
    "lethal": false,
    "heightClass": 0,
    "fallbackRank": 0,
    "neighborBias": { "ruin": 1.5, "path": 1.4, "ruin_floor": 1.5 }
  },
  {
    "id": "terrain.ruin.broken-threshold",
    "numericId": 19,
    "packId": "ruin",
    "weight": 4,
    "mesh": "/assets/proxies/ruin/broken-threshold.proxy.json",
    "rotationQuarterTurns": [0, 1, 2, 3],
    "sockets": {
      "N": "RUIN_FLOOR",
      "E": "PATH",
      "S": "OPEN_FLAT",
      "W": "PATH"
    },